{
  "$ref": "#/definitions/collections",
  "definitions": {
    "collections": {
      "type": "object",
      "properties": {
        "name": {
          "type": "string"
        },
        "title": {
          "type": "string"
        },
        "description": {
          "type": "string"
        },
        "lede": {
          "type": "string"
        },
        "quote": {
          "type": "string"
        },
        "quoteAttr": {
          "type": "string",
          "default": "Bez Ambar"
        },
        "status": {
          "type": "string",
          "enum": [
            "live",
            "draft"
          ],
          "default": "live"
        },
        "spotlights": {
          "type": "array",
          "items": {
            "type": "object",
            "properties": {
              "pieceSlug": {
                "type": "string"
              },
              "heading": {
                "type": "string"
              },
              "body": {
                "type": "string"
              }
            },
            "required": [
              "pieceSlug",
              "heading",
              "body"
            ],
            "additionalProperties": false
          },
          "default": []
        },
        "$schema": {
          "type": "string"
        }
      },
      "required": [
        "name",
        "title",
        "description",
        "lede",
        "quote"
      ],
      "additionalProperties": false
    }
  },
  "$schema": "http://json-schema.org/draft-07/schema#"
}