{
  "name": "Dentelle Collection",
  "title": "Dentelle Collection — Bez Ambar",
  "description": "Lace in diamond. Each piece rendered in fine baguettes and brilliant-cut stones — structure as ornament, precision as poetry. By Bez Ambar, Los Angeles.",
  "lede": "Lace in diamond. Structure as ornament, precision as poetry.",
  "quote": "Lace exists at the edge of structure and dissolution. We made it in diamond.",
  "quoteAttr": "Bez Ambar",
  "status": "live",
  "spotlights": []
}
